{
  "folderName": "circle",
  "filename": "circle",
  "testFilename": "test_circle",
  "testConfigs": [
    {
      "id": 0,
      "shouldFail": false,
      "description": "Musterlösung..."
    },
    {
      "id": 1,
      "shouldFail": true,
      "description": "Die X-Koordinate sollte eine Ganz- oder Fließkommazahl sein."
    },
    {
      "id": 3,
      "shouldFail": true,
      "description": "Der Wert des Konstruktorarguments 'center_x' sollte unter dem selben Namen als Argument zugänglich sein."
    },
    {
      "id": 4,
      "shouldFail": true,
      "description": "Die Y-Koordinate sollte eine Ganz- oder Fließkommazahl sein."
    },
    {
      "id": 5,
      "shouldFail": true,
      "description": "Der Wert des Konstruktorarguments 'center_y' sollte unter dem selben Namen als Argument zugänglich sein."
    },
    {
      "id": 6,
      "shouldFail": true,
      "description": "Der Radius sollte eine Ganz- oder Fließkommazahl sein."
    },
    {
      "id": 7,
      "shouldFail": true,
      "description": "Der Radius sollte größer oder gleich 0 sein."
    },
    {
      "id": 8,
      "shouldFail": true,
      "description": "Der Wert des Konstruktorarguments 'radius' sollte unter dem selben Namen als Argument zugänglich sein."
    },
    {
      "id": 5,
      "shouldFail": true,
      "description": "Die Fläche des Kreises sollte richtig berechnet werden."
    }
  ]
}