{
  "folderName": "pysql",
  "filename": "table",
  "testFilename": "test_table",
  "testConfigs": [
    {
      "id": 0,
      "shouldFail": false,
      "description": "Diese Implementierung ist korrekt und sollte alle Tests bestehen."
    },
    {
      "id": 1,
      "shouldFail": true,
      "description": "Es soll überprüft werden, ob die eingegebene Liste die gleiche Länge wie die Tabellenreihen hat."
    },
    {
      "id": 2,
      "shouldFail": true,
      "description": "Es soll überprüft werden, ob der Inhalt der eingegebenen Liste die gleichen Datentypen hat wie die Anfangsdaten."
    },
    {
      "id": 3,
      "shouldFail": true,
      "description": "Die Funktion sollte bei Erfolg True ausgeben."
    },
    {
      "id": 4,
      "shouldFail": true,
      "description": "Die letzte Zeile der Tabelle muss der angefügten Zeile entsprechen."
    },
    {
      "id": 5,
      "shouldFail": true,
      "description": "Die neue Anzahl an Zeilen muss um genau 1 höher sein."
    },
    {
      "id": 6,
      "shouldFail": true,
      "description": "Zahlen in der neuen Zeile sollen automatisch von Strings zu floats konvertiert werden."
    }
  ]
}